{
  "runner": "codex",
  "session_id": "codex-target-001",
  "branch": "codex/dual-runner-handoff",
  "worktree_path": "/worktrees/dual-runner-handoff",
  "started_at": "2026-03-20T08:55:00Z",
  "last_heartbeat": "2026-03-20T09:00:00Z",
  "claimed_feature": null,
  "claimed_tasks": [99],
  "state": "active",
  "runtime_artifacts": {
    "root": ".claude/cx/runtime/codex/codex-target-001",
    "state_file": ".claude/cx/runtime/codex/codex-target-001/session.json",
    "transcript": ".claude/cx/runtime/codex/codex-target-001/transcript.md",
    "heartbeat_file": ".claude/cx/runtime/codex/codex-target-001/heartbeat.json"
  }
}
